,body,rf_prediction,nb_prediction,lr_prediction
268,"The recommendation I made for Islam.SE: I would propose basing our system on the one that's been developed for Wikipedia here. The Standard Transliteration rules (e.g., arkan instead of either arkān or arkaan) should be sufficient for most purposes. If an exact reading is required for something it would probably be better to just quote the Arabic text itself. The Strict (rather than Standard) transliteration would be even better, since it clearly and reversibly maps to the Arabic alphabet, but I feel enforcing it too strictly would be difficult because of the difficulty in typing the necessary diacritics on a standard keyboard. I can understand the appeal for Buckwalter from a linguistic point of view — not only does it clearly and reversibly map to the Arabic alphabet, but it does so with standard characters — but it also has the annoying side-effect of being difficult to actually just read. And yes, I too strongly oppose any suggestion to use Arabizi. It just looks...ugly. And unprofessional. But mostly ugly.",arabic.meta,arabic.meta,arabic.meta
269,"I've stumbled upon following question with the title 'Which words are the same across Hebrew and Arabic?' I've answered it in some short sentences, referring to semitic languages. Still I feel this question should be closed. Are questions like that conform to the community guidelines (or to the one we want to establish)?
What are the reasons to close questions like that. An obvious reason to close the question would be that it is too broad, a short answer actually answering the question can't be provided. Leaving that aside, questions like that would give this site character of an etymological dictionary.",beer,ai,arabic.meta
270,"It's simply too broad. What do you think they would do in SE EL if someone posted a question like ""Which words are the same across English and German?""",avp,ai,avp
271,The link below shows no users http://arabic.stackexchange.com/users?tab=moderators,avp,ai,avp
272,"In the beginning, beta sites are moderated by the Stack Exchange community team. Once we've started to establish a community and they have enough information to gauge who will (and will not) be a good moderator, they'll appoint site-specific moderators. This should take place in a couple weeks (about a week into public beta), but may take more or less time depending on how well (and how quickly) the community gels. They do take community input into consideration, so starting a thread discussing who would make a good moderator would be a valuable asset for the community team when they do appoint. Relevant blog post: https://blog.stackexchange.com/2010/07/moderator-pro-tempore/",beer,avp,beer
273,"I have voted to close that question. I will use this post to try and explain my logic. I have currently brought over the rules used on SO, known also as StackOverflow (where I am active). These rules might not apply to this site but only time will tell so I will change how I use this site as situations force me to change how I think about this site's moderation. First off, I do still stand by my decision to state that your answer does not really answer the question and that the one below yours goes as close as possible, but that might be my own misconception of what defines an answer here. On SO your answer would have been deleted and converted into a comment and that might just be my misconception of applying SO rules here. Now back to the topic: whether a question can be answered or not is not based on whether or not the answer is short. Take some of the best network questions, they can be pages long at times. A close reason is not ""the answer is not short enough"", it is about whether or not the topic is too broad that even a long answer couldn't answer it. In this case it would require literally a word by word comparison of both languages to complete the entire question, even though one answer goes some way. That is just an impossibly huge task for an answer. As such this question is considered too broad in my opinion.",ai,arabic.meta,arabic.meta
274,"We did talk about this in Area51. The consensus there was that if native Arabic speakers want to answer only in Arabic on only Arabic questions then that is up to them. Not much we can do about it since this site is designed for everyone, not just those whose first language is English. It is said that if the question is in English then you should answer in English. As for understanding the questions: if you cannot yet piece together Arabic via your own understanding of it's structure and using Google translate to fill in the gaps of unknown words then the purely Arabic questions might be too high a level for you anyway; you might be tying to run before you can walk. It was found that most who would ask/answer in Arabic would be scholars and advanced students, whereas those who are still not totally accustomed to speaking Arabic on a daily basis yet will easily feed on the newbie questions. It is hard to say whether this will hold true yet, we need to get more questions and community but that was the assumption. As a footnote: there was talk about allowing people to translate Arabic questions and answers to have a English definition side by side, but again, not sure about that currently. We will just take it as it comes on this one, impossible to foresee how it will pan out. As an edit: that does seem like a question whose answer should be in English and Arabic, especially since an English edition of the question was provided.",arabic.meta,arabic.meta,arabic.meta
275,"Based on the discussion in Area 51, I understood the goal of SE Arabic to be for all levels---the equivalent of both English Language & Usage and English Language Learners.  That could include both basic questions in English by people who wouldn't be able to translate an Arabic answer, and questions written in Arabic by native speakers which will likely be answered by other native speakers also in Arabic. As a community, we need to start developing norms.  I would suggest:",arabic.meta,arabic.meta,arabic.meta
276,"It has been brought up on the main Meta.SE here so I am bringing it up here, I would like to ask if it is possible for arabic tagging support to be provided. ",beer,3dprinting,arabic
277,"حاولت طرح سؤال قبل قليل لكن تعرضت لي رسالة خطأ تقول: This question body does not meet our quality standards. Please make
  sure that it completely describes your problem - including what you
  have already tried - and is written using proper grammar. ",arabic,ai,beer
278,I think it suppose to show only the unanswered questions  http://arabic.stackexchange.com/unanswered,avp,agur.meta,arabic
279,"That is by design. If the questioner hasn't considered any of the given answers worth accepting, nor has the community considered any of them useful enough to even have a positive score, then the site considers it a question that still needs a proper answer: So far as that page is concerned, ""Unanswered"" means ""No upvoted or accepted answers"", not ""No posted answers at all"".  On the ""Unanswered"" page, there's a ""No Answers"" tab that will display posts that explicitly have no posted answers, if that's something you actually want. See also:",bioinformatics,agur,agur
280,"Unfortunately not at this time, as Sammaye correctly mentioned in the comments. The Islam site uses Arabic words transliterated into Latin script in their tags, with the Arabic words written in the tag wikis and summaries. I think that's just about the best we've got as far as workarounds go for now.",arabic,arabic,arabic
281,"I asked this question about listing words that are considered feminine by Arabs. It was closed as ""too broad"" with some comments relating to other, open-ended list-type questions. My understanding is that of this comment: this is not an open-ended nor large list of words. It's supposed to be a small (dozen or so), well-known, non-changing list. The question already has two votes to re-open, so please consider casting yours too. This begs the deeper question of what, if any, ""list""-type questions would make sense for the site.",ai,avp,beer
282,"I think the key criterion for a word-list question is that it has to be feasible to list all the words. In practice this means that the list must be relatively small (certainly <100, perhaps smaller still), well-defined, and non-changing. (Otherwise an answer can never be complete or correct, as there will always be entries either missing or debatable). As to the question that motivated this meta, the reference I have to hand (A Reference Grammar of MSA, K. Ryding, 2005) says ""This is a small, defined set"" - so I believe a good, definitive answer is possible (and would also be incredibly useful to learners).",agur.meta,arabic.meta,agur.meta
283,"I noticed that many of the questions asked on the site uses the [question] tag, is that acceptable? I cannot see any value in this tag, aren't these all questions after all?  I believe this tag is used to overcome the tagging requirement without having to think of the proper tags, specially that there are not much of them yet. Is there a way to prohibit such tag, or should we manually re-tag these questions?",beer,arabic.meta,arabic.meta
284,"How should poetry verse-haves (Sadr and Ajuz - صدر وعجز بيت الشعر) be separated?
Posters uses various way to do so, for example: Should we be concerned about this issue? Is there some form that might has advantage over others? I'm concerned here about two issues here; clarity and searching.",3dprinting,ai,arabic
285,"Since you can ask in Arabic or English, it will happen to find duplicate between the two languages. Should we close them as duplicate? From my point of view, we can't consider them like that: Many users know only English and Many know only Arabic. You can't just tell the OP, go and check the other question; He/She will not understand it.",arabic,arabic.meta,agur.meta
286,"Questions should absolutely not be tagged with question unless they are specifically about how to form a question grammatically in Arabic. (I can't read Arabic, so I can't tell if that's the case with these questions.) The question tag should be removed from those questions, and they should be given more useful tags.  This blog post is a good explanation of why we do not use meta-tags like question.",arabic.meta,ai,arabic.meta
287,"I would say no. Closing as Duplicate is basically just saying ""Every single possible answer to this question is a possible answer to that question"", but under the general principle of ""English questions should have English answers and Arabic questions should have Arabic answers"", that would not be the case: Like you say, Arabic answers would not be of any use to someone asking an English question, and vice-versa. Here, the only way I can see closing as Duplicate being appropriate is if the duplicate target is bilingual, written in both Arabic and English (the question, as well as all answers). I couldn't say whether it's worth creating a third (bilingual) question — translating all the top answers from the originals — just so you can close the other two as duplicates of it, but I imagine for some questions that would be a viable course of action.",arabic.meta,arabic.meta,arabic.meta
288,"I just came across the tag genders. I wanted to change it to ""gender"", but I was not able to and was asked to ""raise it [i.e. the issue] on meta"". So this is what I am doing now. The tag should be gender and not genders (i.e. should be without the ""s"").",arabic,arabic.meta,avp
289,You are totally correct. The mentioned question has been put on hold as it's indeed too broad!,avp,agur.meta,arabic
290,"In my opinion, and for indexing purposes, we should add the translation in the older question and answer, then mark the new question as duplicate. By this way, we can make sure that all users can find the correct answer in one indexed link, plus, all answers can be collected in one place! :)",agur.meta,agur.meta,agur.meta
291,"I am in full agreement - when I asked my question I was surprised to be forced into genders when ""gender"" seems much more appropriate. In general in English the singular ""gender"" is used to refer to the topic of grammatical gender in general, so that's what the tag name should be.",3dprinting,arabic.meta,3dprinting
292,"I agree, and I have made this change.",arabic,arabic,bricks
293,"I just wanted to cast a vote for closing a question. The reason was that I thought the question was too specified. This reason, which I know from other SE sites, did not show up as an option. I think it should be added. Questions may be too broad and unlikely to reeve a definite answer. Other questions however may be to narrow and will be of interest for only one or few people by not for the community of Arabic language learner sand enthusiasts. ",agur.meta,agur,agur.meta
294,"There is no automatic way of prohibiting the existence of poor tags, or the practice of abusing existing tags. These moderation tasks have to be done by the community. A basic moderation task is to make sure that new questions are tagged appropriately. This means adding missing tags and removing inappropriate tags, and possibly adding a comment pointing the user to the tag-wiki to explain proper use of a particular tag. Unfortunately, there are currently a lot of tags with no wiki-text. As such, users have no guidance as to whether a tag is appropriate for their question. This leads to meta-tagging and other abuses.  Along with the lack of guidance, not requiring wiki-text when creating new tags leads to a proliferation of separate tags where tag-synonyms might be more appropriate (article, arabic-the, al). There should be cases where one tag is used and another is not, whereas arabic-the and al would always be together since they refer to the exact same thing. Just as new questions are moderated, new tags should be moderated. Each tag should have a tag-wiki which justifies its existence and distinguishes its use from existing tags. If these requirements cannot be met, then the new tag should be removed from the list of available tags.",ai,avp,ai
295,"incorrect assessing: This post appears to be a duplicate of هل هناك أسماء لا تتضمن التذكير
  أو التأنيث؟ ",avp,arabic.meta,avp
296,"My answer to the question about silent letters in Arabic has so far received three downvotes (as well as one upvote). Ordinarily with a downvote I don't understand I'd shrug and say ""downvotes happen"", but three on the same question - and with only one upvote - make me think there must be something seriously wrong with the answer. However, the only comments left on the answer complain that the word ""مائة"" was misspelt. Once I added references to show that this is a valid spelling, the commenter appeared to be satisfied. So I'm at a loss to understand what is wrong here. And, in general, how should the answer be improved? I feel this is something we need to be clear about as a community, because I believe that my answer is a good one, though clearly others disagree - and if there is a lot of disagreement in the community over what makes a good answer, we won't get a lot of good answers and people will leave...",agur.meta,beer,beer
297,"Well, I didn't really get satisfied but, I came to know that this exact word is a bit controversial. The question is clear. despite those facts, and even if we consider your word is correct in spelling, it doesn't really provide an answer! It is anyways only a word, not a grammar rule. I can give you tens of similar words where a letter isn't pronounced in those particular words!
However, we can't consider them as a rule.",agur,arabic,arabic
298,"I find myself having to zoom in to read what is written at times, especially when vowel signs are present. Does anyone have any prior experience with this kind of an issue (I'm thinking maybe from islam.stackexchange.com)? Are there any workarounds for making the typeface larger without having to resort to zooming in and out? For a few of my questions in which I cite Qur'anic verses I find it much easier to just link an image of the verse rather than mention the text itself, but this won't always be possible.",3dprinting,bricks,bricks
299,"As goldPseudo noted in the comments above, Too Localized was removed as a close reason back in 2013: Too Localized was, by far, the most misused close reason in our surveys, with both Community Managers and Moderators deeming over 50% of randomly sampled TL closures to not have merited closure (including on SO). Today, TL is used helpfully on code dump questions on SO, but the new OT reasons are where this is now correctly addressed. SO can use ""Large blocks of code with requests for debugging without meaningful supporting info"" as a specific OT reason. So what does this mean for Arabic? Well, with enough consensus, the community could add a custom off-topic close reason for cases like these. But in the meantime it's important to think through why a ""too localized"" question is actually bad for Arabic Language SE.  One result of ""too localized"" being removed as a network-wide close reason is that communities are now better able to decide for themselves that constitutes a useful question. On a language site like Arabic, many questions would qualify as what used to be ""too localized"" on Stack Overflow. They answer one person's question, but they don't always solve a common problem people have when writing or speaking Arabic that they'll end up searching for. And yet, we still find such questions (examples: 1, 2) valuable1 as we build a compendium of knowledge about Arabic--and a community of knowledgeable people who like learning and teaching about Arabic concepts and history. So, tl;dr:  1: I can't read Arabic so I've done my best to choose questions that I think illustrate my point, but please let me know if I'm off base here.",agur,arabic.meta,beer
300,"Yes, the font is terrible (on my computer, at least - people may have different experiences on different web browsers/OSs/form factors etc). I'm not aware of a good workaround, other than zooming in - you could potentially do something with a user stylesheet or a Greasemonkey script to change the font, but that seems like a lot of work! I'm hoping the Stack Exchange team update the style at some point to make Arabic text more readable.",beer,3dprinting,beer
301,"Here's a greasemonkey script (Slightly modified from original source: https://www.reddit.com/r/learn_arabic/comments/2zpobd/arabic_font_size/) which will detect Arabic text on any *.stackexchange.com site (including chat) and increase the size (without affecting non-Arabic text): Adjusting the GM_addStyle(...); line lets you tweak things to your liking; as is, this will increase the font size by 30% but otherwise stick to the defaults, but with a little knowledge of CSS it's easy to change the size, color, and even the actual font: No extension  GM_addStyle(""span[lang~='ar'] {font-size: 130% !important }"");  GM_addStyle(""span[lang~='ar'] {font-family: andalus; color: green !important }"");  GM_addStyle(""span[lang~='ar'] {font-family: arabic typesetting; font-size: 200% !important }""); ",3dprinting,arabic.meta,beer
302,"Arabic texts are aligned to left. For example: عنوان: هذا نص عربي. When a question/answer is all in Arabic, the text preferably be aligned to right.  Numbers in list start from left , while the Arabic start from right: Parenthesis/Quotes/Symbols does not respect Right-to-left when ending with them in Arabic texts: كلمة عربية (شرح).  كلمة عربية ""شرح"".",3dprinting,arabic.meta,arabic.meta
303,"I don't see a problem using any separator. I have the idea of applying  a feature request , a feature of Auto-highlighting of Arabic poetry.  Something like this to get somethings or Centering and Justifying the text and adding the separator between each couple of lines. And preferably giving it a nice font and nice style. highlighting vowels as an extra.",bricks,arabic.meta,arabic
304,"Yes, this had been annoying me, too :) I don't know of a workaround for the first two issues - I think the SE folks need to add support for the dir=""rtl"" attribute on a number of tags - at the very least <p>, <ol> and <ul>. Or perhaps start using dir=""auto"" The third issue (parentheses/quotes/etc), at least, can be worked around by adding a Unicode ""right-to-left marker"" character at the end of the text (after the ""broken"" punctuation). This can either be an explicit character (U+200F), or the corresponding HTML entity &#x200f; (or &rlm;). For example: Original (broken) كلمة عربية (شرح). Using a literal RLM character after the ""."" كلمة عربية (شرح).‏ Using an HTML entity كلمة عربية (شرح).‏ Adding the HTML entity is easy (you can just type &rlm; into the edit window), but the trouble is that, although the final (rendered) text looks good, the text in the edit box is still all in the wrong order (and looks worse because now you have the extra &rlm; cluttering things up). Adding the literal character is trickier, but it makes the edited text look good too. One option, on Windows, is to use Notepad, and choose ""Insert Unicode Control Character -> RLM"" from the menu - then copy and paste into the edit window.",agur.meta,avp,3dprinting
305,"Writing in the Arabic script requires some knowledge of the script, some knowledge of computing in Arabic, and possibly some limitations associated with the user's computer. We don't know why a user chose to use transliteration, so I suggest that we allow people to ask and answer questions using whatever script/scheme allows them to communicate (even Arabizi). Each transliteration scheme is intended for a specific purpose. A priori, we do not know the reason a user is using a particular transliteration scheme, and if we were to enforce a particular transliteration scheme, then we might be excluding users from the site. If the transliteration scheme used by a user is not sufficiently clear to other users, then we can always put the question on hold as ""Unclear due to ambiguous transliteration.""  Finally, reviewers can easily add the proper Arabic script next to the transliterations in questions and accepted answers. It would be best if the users themselves could use the Arabic script for words and the International Phonetic Alphabet (IPA) for pronunciations, but do we want to exclude users if they can't?",bioinformatics,bioinformatics,bioinformatics
306,"When a question is marked as duplicate, does it prevent new answers? Does it get deleted? These would be additional reasons to not mark these questions as duplicates. I would prefer to leave these pairs of questions open for the reasons @bigOTHER gave in the question. Translation is difficult for reviewers, but allowing users to answer the duplicate question effectively gets the translation done, and rewards the translators with reputation, which they deserve for their contribution to the site. In the sidebar there is a list of Linked questions, so it makes sense that equivalent questions in the two languages are at least linked, if not marked duplicate.",agur,avp,agur
307,"I've had a look at this and run the provided text through the engine a few times, and ultimately it comes down to an inherent problem in telling the difference between two posts with very short body text (not the title - the actual body). I can investigate this, but I suspect the ideal solution is simply: have longer question text. It seems unlikely that the full nuance and depth of most questions can be conveyed in 30 characters - indeed, it is usually a warning sign if the question title and question body are virtually the same thing. However! I don't understand the question or the nuance (due to the language barrier); so allow me to ask: are both the questions (the body, not the title), as asked, good questions with all the necessary information? If these are both valid questions in their current form, we can look at how to make this work.",beer,agur.meta,beer
308,"This site will enter public beta soon, which means it's time to give a few users moderator privileges. Ideally, moderators are elected by the community, but until this site reaches a critical mass to hold an election, we will be appointing some provisional moderators to fill that role. We need your help. Please nominate some folks you might like to see become the provisional moderators for this site. Your input will provide some valuable support to help us make our selections. You can read more about the process here: Moderators Pro Tempore.  We are seeking out members who are deeply engaged in the community's development; members who: Here is an example nomination entry. You can copy-and-paste from the format below: <h2>[username](<main profile link>) </h2> <h2>[Meta Profile](<meta profile link>) </h2> Notes: <why you feel nominee would be a useful addition to the pro tem choices> --- (this section is edited in by the nominee) I accept/decline this nomination I am name/age/location/fun fact/all optional. I live in location, so I am generally active on this site from <time> to <time>. Some other things you may want to know about me are…  etc.",bioinformatics,bioinformatics,bioinformatics
