,body,rf_prediction,nb_prediction,lr_prediction
351,"A core goal of the private beta is to generate high-quality content that will attract experts. We are also given the opportunity to invite experts by email to the private beta. My question is simple: exactly what kind of experts are we trying to attract? According to  this question , data science and the implementation of artificial intelligence are off-topic. The problem is that we don't want to become a duplicate of Stats or Data Science SE. The question links to this answer on Area 51 which says that this site is for questions in the ""academic humanities arena"". This seems to suggest that we want experts in academic humanities. However, most experts in the field of artificial intelligence are experts of implementation. They are applied mathematicians and computer scientists who are trying to make artificial intelligence a reality. The recent advances in artificial intelligence, like  Alpha Go, have been the result of breakthroughs in implementation. If this site is about humanities-style questions about Artificial Intelligence, then what appeal does it have to the type of people who created Alpha Go, who are primarily computer scientists and mathematicians? I'm not convinced they have special expertise about the ramifications of Artifical Intelligence on human society, politics, law, etc. Perhaps we need to redefine what this site is about. I think a place to look for inspiration is Math SE and MathOverflow. One is about mathematics at any level, while the other is a site for research level mathematicians. Maybe Artificial Intelligence SE should be to Data Science SE and Stats SE what MathOverflow is to Math SE. That is, it should be a site about tackling research level AI problems with the tools of data science and statistics.  This means that we'll have to seriously elevate the quality of our questions and answers to attract real AI experts. But at least we'll have  experts to attract.",agur,ai,ai
352,Study of abstract machines as well as the computational problems that can be solved using them.,avp,arabic,arabic
353,Artificial intelligence is based on the assumption that the process of human thought can be mechanized.,avp,3dprinting,3dprinting
354,"I probably don't need to explain that :-) And for the bots, how about Daneel and Giskard?",bricks,beer,beer
355,Bots: Meta & Cognition,arabic,ai,avp
356,"First up, when I posted my answer to the question you reference, I was just passing along the information given to us by Robert Cartaino. I'm not wedded to that opinion. I think all the scientists working on AI would be helpful here even though we're not working on implementation. This is what the original Area 51 Discussion post said (excerpted): Data Science is an applied site for all the programmers/statisticians/mathematicians who are trying to make this stuff work. There's some leeway there. Specifically, technical questions seem to be OK, as long as they're not super in depth about the math or programming. There are also ""why"" questions (as opposed to ""how"") that are very interesting and educational. I like this question a lot. Scientists are welcome. We don't have to limit ourselves to the philosophy and practical effects of AI, though they're in scope. Philosophers are welcome too.",agur,avp,agur
357,"First there is a need to distinguish modeling from implementation. They are not exactly the same, although strongly related. This was a very difficult lesson to learn among mathematicians and early programmers, notably in the 70s (mathematical proofs can demand a lot of non-trivial programming work to make them ""computable"", as in runnable on a computer). As for Machine Learning (by far the most active AI category), modeling belongs to Data Science SE---perhaps the one thing that most people agree on. Implementation should be out of there, as the issues and focus differ (but again, they are related). Now, should implementation issues be in AI SE, or StackOverflow? The recurring example is TensorFlow, who's home page states that questions should go to StackOverflow. And we should respect that... But we should keep in mind that the TensorFlow team will choose SO, because it is the largest community, and because the team has something else to do rather than experimenting with hardly visible communities. Well, size matters. We may think that if AI SE becomes big enough on the implementation side, the TensorFlow team (and other major frameworks) may move actually. In fact, I think now that implementation questions would benefit from a dedicated site (my view has evolved since the Area 51 definition phase). I have replied and tried to reply to several SO questions related to ML tools, and I think some are out of place compared to other questions. For example, some TensorFlow questions are not really programming questions, and not really framework questions. I mean, there is background knowledge on graph construction and execution, as well as background knowledge about statistics and probabilities that are really necessary to make meaningful contributions. This is not to say that all questions are out of place on SO. Some are really framework issues or (Python) programming issues, and they are good there. Based on this opinion, I think the site should be interested in implementation experts, whether they work on ML or Expert Systems (or both?). See also some threads on Area 51 like this one and this one.",bioinformatics,bioinformatics,beer
358,"I'm seeing a lot of answers from people along the lines of ""AI is just bits and bytes and ultimately cannot be smarter than its creator because its creator would have to use their brain to make something smarter than themselves, which isn't possible."" I think this argument is a bit unclear and needs some refinement. It is true that AI can indeed be smarter than the creator at certain tasks (AlphaGo being better at Go than the programmers of AlphaGo, for instance). What I think this argument is really saying is: ""AI is just bits and bytes programmed by its creator. The creator would be able to know how the AI works, otherwise he would be unable to create it in the first place. Therefore, the creator can be said to be superior to that of its creation, since the creator can understand its creation."" That seems like a more logical premise. Sure, AlphaGo is better at Go than the programmers of AlphaGo, but AlphaGo's programmers actually knows how AlphaGo operates. This type of argument was made in the paper Creativity, the Turing Test, and the (better) Lovelace Test, which specifically argues that  AIs cannot be creative since programmers are able to figure out what their creations (AIs) are doing. Another paper ""The Lovelace 2.0 Test of Artificial Creativity and Intelligence"" saw this argument as so self-evidently true that it tried to create a weaker version of the Lovelace Test to identify and measure AI creativity. The programmers, basically, know how their program works. That doesn't mean the program is less intelligent than the programmers. Just that the programmers can understand why their programs behave the way they do, given enough time and patience. Either way, I would not support discouraging answers such as these, if only because this view does have support within the AI scholarly community. If you have experts who hold this view, then we should let this view be given exposure.",arabic.meta,arabic.meta,bioinformatics
359,"This would be about deep learning which is about multiple layers of neurons. So, as DL has been very hot in the domain currently, I think this name would be appropriate. ",arabic,agur,agur
360,As in Blade Runner. And HAL and Computer for the bots.,avp,agur,avp
361,"Electric sheep I think everyone knows this, just in case: wiki link",arabic,3dprinting,3dprinting
362,"A reference to the Chinese Room Argument.   We would need to make it clear that we're separate from Chinese.SE though...! One of the bots could be named Searle, who invented the thought experiment.
Then we really have a Searle getting inputs and producing outputs, just as in the thought experiment.",ai,bricks,3dprinting
363,"A reference to backpropagation neural networks. We could use this name because in our chatroom, ideas will be propagated back and forth.",avp,bricks,bricks
364,"How does the final phase of Augur Market adjudication work and what is the difference from AgnosticPM?   I believe that Augur's final phase of adjudication forks off the market into two separate markets and whichever market has the highest valued rep is the one that gets the winnings? It sounds like AgnosticPM is using a similar method of a decentralized prediction market without oracles, relying on the market to gravitate towards the correct result long after the end of a market.  But there appears to be more to this approach, where it links to the results of previously successfully adjudicated markets.  Does anyone know how this mechanism works in practice?",agur,agur,agur
365,"Is Augur's reputation token a cryptocurrency in traditional sense, or not? Is it based on Bitcoin's source code?",agur,agur,agur
366,"I've read that there are different kind of ""tokens"" that can be used across Augur project. What are these and what's their purpose?",agur,agur,agur
367,"Are all trades published after the trade has been completely executed? If so, to whom are they visible? Only for token holders, or to everyone else?",agur,agur,agur
368,"Some while a go, we could read the following message on Augur website which reads: Imagine an Early Warning System for everything that tapped into the collective awareness of humanity. Imagine better forecasts about politics, commerce, technology, entertainment and more.” How exactly Augur can be used in politics? Can you give some examples?",agur,avp,agur
369,"In U.S. sports betting is illegal in most states and markets are tightly regulated by the Commodity Futures Trading Commission (CTFC). This can be also the case in different countries. So what are the legal implications of using decentralized gambling platform? Is it legal, or illegal?",agur,3dprinting,agur
370,"Augur uses a blockchain to distribute trades. Since there are no servers or employees there is no easy way of taking it down (similar to other peer-to-peer technologies). Are there any other concerns about how Augur can be disrupted from operating correctly, like firewall rules, fake blockchains, exploits, or other methods?",agur,3dprinting,agur
371,"The final fallback for market resolution (after all reporters have reported on an event and someone still believes the answer is wrong) is called Fork Resolution.  Only one fork can be active at a time per branch (in Augur, a branch is akin to an entire universe that is isolated from other universes).  Once a fork starts, all other markets that are awaiting reporter based resolution (this does not include automated reporting) are delayed until the fork resolves.  Once the fork resolves, all of those pending markets will migrate to the branch (universe) that won the fork. The fact that existing markets migrate to a particular world view is one of the first differences with AgnosticPM.  In AgnosticPM, the universe a market lives in is based entirely on markets that came before.  In Augur, while a market is created within a particular universe (branch), it will migrate forward to another branch if a fork occurs before the market settles.  The reason for this is because if a fork occurs, we must assume that reporters have been compromised and any reporting they do is invalid.  It is also assumed that the fork resolution process is the best answer we have to ""who was right"". As for how the fork resolution process actually works, its pretty simple.  Before the fork, there is REP (tokens) that is associated with a particular branch (universe).  This REP is traded on exchanges and has some market value.  When a fork occurs, a new branch is created (conceptually) for every possible outcome and each branch has a new REP token.  Anyone who holds the original REP token can convert (1:1 ratio) their token to a REP token on any branch of the fork.  The act of converting your REP from the parent branch to a child is how you vote for which branch you think represents reality.  Once you have cast your vote, there is no going back so be certain! At the end of the fork (currently ~2 months) whichever branch had the most REP migrated to it is considered the winner and all existing markets needing reporting will migrate to that branch, and share tokens for the forking market will be redeemed using the outcome from that branch. This begs the question, why would I risk my REP casting a vote instead of just keeping my original REP?  The answer to this is that no new markets can be created on the original branch and all existing markets will resolve on the winning branch.  This means that REP on the original branch will yield no reporting fees to REP holders as there will be no markets to report on.  As a REP holder, your job is to pick the branch that you think the most future fees will come from.  This means you want to pick the branch that has the most market participation (volume/outstanding interest) so your REP gets the maximum amount of fees long term.  In almost all cases, this will be the branch that represents the truth/reality.  The only cases where this is less certain are forks that are highly contentious, where not everyone agrees on what reality even means. In order to incentivize people to migrate their REP during the voting period (tentatively 2 months), there will likely be some small inflation assigned to everyone who migrates sooner rather than later (e.g., 5%).  The idea here is that if you pick a side (rather than abstaining) then your share of REP will not be diluted.  If you abstain, then your share of REP will be diluted by some amount relative to how many people migrate.  The goal here is to make it so abstaining from the vote is a losing strategy in almost all cases (non-contentious forks) as this increases the cost of mounting a forking attack against Augur. Regarding AgnosticPM, Augur is similar in that it has a concept of branches (universes) which have a history of truths associated with them.  The primary difference between Augur and AgnosticPM is that Augur has a concept of finality, meaning that the system has the ability to assert that a particular outcome is an absolute truth for the sake of paying out winnings.  In AgnosticPM, there is no way to extract deposited ETH from the system, its ETH-in-only.  This is a pretty huge difference as it means that AgnosticPM, while fun and possibly effective, doesn't have a way of liquidating its ETH holdings back to participants to payout.  As long as AgnosticPM experiences heavy growth, this may not be a problem but if it ever ceases to experience usage growth then this becomes a big problem.  Investors know this, which will likely make them hesitant to buy any AgnosticPM share tokens, which is likely to drive their value to below 1 ETH (their target).",agur,agur,agur
372,"REP is a token, not a crypto-currency (though the lines between the two are a bit blurred). Augur is not based on Bitcoin source code, it has its own code base and is built on top of Ethereum.",agur,agur,agur
373,"The quoted text above specifically mentions ""forecasts about politics"". The best current example of political forecast prediction markets I know of is PredictIt, a research project run out of Victoria University in Wellington, NZ. Augur improves on PredictIt (and other centralized prediction markets) in a number of ways: Taken together these properties make political forecast markets on Augur both more diverse and more accurate, as well as more resilient to legal challenge.",agur,3dprinting,agur
374,"The following names are from the code, but are subject to change: All tokens are transferable and ERC20 (ish) compatible.  This means you could trade them on an exchange if you really wanted, or transfer them between accounts.  None of the tokens ever suffer any kind of freeze or lock up, so you are always in full control of them.",beer,avp,beer
375,"I'd like to start trading on the Augur. Which cryptocurrency can be used for transactions, Bitcoin or any other internal currency?",agur,arabic.meta,arabic
376,"All Augur token trades are settled on the blockchain.  This means that anyone can see the Ethereum address of the trading participants by just inspecting/monitoring the blockchain.  Of course, addresses are free to create so actually associating an address with a human is a much harder task.",agur,agur.meta,agur
377,"Some jurisdictions ban betting, others ban facilitating betting (e.g., running a betting site).  If your jurisdiction bans the act of placing a bet then it would likely be illegal for you to use Augur within your jurisdiction.  If, on the other hand, your jurisdiction only has a ban on the facilitation of betting, then the Augur platform may be illegal (though, its unclear who the criminal here is since Augur is a decentralized platform), but its usage may be legal. As with most laws, those revolving around gambling have not kept up with changing technology and therefore are up to massive speculative interpretation until tried in court.  If you are concerned and live in a jurisdiction that limits your personal freedoms, the safest course of action is to either consult an attorney (who will probably tell you the answer is unknown) or simply don't risk it.",agur,avp,arabic
378,"A motivated actor with a willingness to burn capital in an effort to hurt Augur can do so in a number of ways, here are a couple I can think of off the top of my head:",arabic,arabic,3dprinting
379,"Initially, only ETH or shares in other Augur markets will be allowed.  There are plans to switch over to a stable coin, once one has proven itself (e.g., DAI).  Long term the plan is to allow markets to be denominated in any token, though that is still up for debate as it could lead to fragmentation and there are some hard engineering problems that need to be solved first.",3dprinting,agur,beer
380,"Predictions are as old as, well, Augurs in Ancient Roman times and older, and the question has always been: how reliable are these predictions? I remember one national election (in The Netherlands) about a decade ago, where a rather large group of people playing some kind of 'stock exchange' game with stocks representing different parties, being able to give a better prediction of the outcome than all pollsters. Possible explanations for this included the Efficent Market Hypothesis but at that time, it felt rather hard to believe. Still, it looks like something Augur could have facilitated. Has there been any research comparing the accuracy of predictions by Augur, or prediction markets in general, to polls or opinions by subject matter experts?",arabic.meta,3dprinting,agur
381,"The idea with prediction markets and politics is that they can provide a better source of information than polls.  Someone could create a market for ""Who will win the 2016 US Presidential Election"" and then anyone can place bets on who will win.  The idea is that the the current trading price is representative of the probability for each candidate to win. Augur supports markets with up to 8 outcomes, which means they can easily support an 8-candidate political election. There have been some theories on Futurarchy where markets can predict the success of laws and use that prediction to drive lawmaking over time.  The problem with this is that defining success metrics with a clear schelling point for legislation is really hard, so I don't see this happening soon.",agur,agur,agur
382,Augur promises betting and trading as seen seen in commodities markets into next level into a distributed blockchain network. Is the project capable of replacing of standard commodities markets?,arabic,agur.meta,arabic
383,"Since Augur can be used as gambling prediction platform, can it also be used for running lotto or roulette? If not, can you elaborate why not?",arabic,arabic.meta,arabic
384,"Sort of.  Financial derivatives markets make complete sense on Augur.  However, Augur isn't designed to deal with actual settlement like real commodity markets are.  So there could be an Augur market for March 2018 CBOT Corn that would likely track the official CBOT March 2018 Corn market, and it would finalize at whatever the official one settles at in March 2018.",agur,3dprinting,3dprinting
385,"Augur is not a good replacement for random-number based gambling.  In particular, Augur needs to be able to resolve markets with some value that reporters can all agree on, and a random number that they each roll is not good at that. You could, in theory, create a market like, ""What will the first digit of block number 1234 be?"" and then people could try to predict what that will be.  I'm not sure this makes for a particularly compelling gambling game, and you could create such a gambling game much simpler on-chain (no need for reporters). Note: Block hashes aren't good sources of random numbers, and in general getting random numbers trustlessly onto a blockchain is really hard.",agur,agur,bioinformatics
386,"Assuming Augur may be used in the future in an illegal manner (such as non-regulated casino, federal anti-gambling laws, or be used for money laundering), how can law enforcement prevent criminal activities in order to bring criminals to justice? It seems especially difficult to identify these people because Augur doesn't collect personal information on any of its users.",agur,agur,agur
387,"They can't effectively. Ineffectively, their best bet would be to attack Augur as described in Can stability of Augur be disrupted?.  They could also try to track down the individual participants and go after them.  Tracking a pseudoanonymous Ethereum user is a pretty difficult/expensive process, but I won't put it past a state actor blowing a lot of resources in an attempt to make an example out of someone. Alternatively, they could go after the Augur development team (though this would go against some freedom of speech laws in the US where the current development team lives), but this wouldn't shutdown Augur, just stop development until new developers (perhaps in more freedom friendly jurisdictions) took up the project.",agur,arabic.meta,agur
388,What was the original inspiration behind the Augur project? How the idea started?,arabic,agur,agur
389,Some of these other projects raised massive amounts of money at their ICOs. What will make Augur different or better?,arabic,arabic,arabic
390,"The Parasite Contract   Behold this outline for a Smart Contract:   The description above was taken from:
http://www.truthcoin.info/blog/contracts-oracles-sidechains/ ",beer,3dprinting,3dprinting
391,"Augur is a trustless Ethereum Oracle, with a prediction market built on top.  The others are all prediction markets in need of an Oracle.  I believe the plan for all of the others is to launch with trusted Oracles and then once Augur is finished, integrate Augur's Oracle into their prediction markets.",agur,agur.meta,arabic
392,"Based on the Howey test it seems like it could be argued that a REP token hits all these indicators. It is an investment of money?
Yes, clearly. There is an expectation of profits from the investment?
Yes the REP token is one of the few tokens which should generate income. The investment of money is in a common enterprise?
Yes, I think its fair to call the Augur network or even any individual market within it a ""common enterprise"". Does the potential profit come from the efforts of a promoter or third party?
Potentially yes as the REP holders cannot earn a profit without the efforts of the market creators.   I'd love to hear other interpretations.",agur,agur,beer
