,body,rf_prediction,nb_prediction,lr_prediction
0,"Are questions related to megabloks and similar products on-topic? I ask because the site is bricks.stackexchange.com, but the logo is LEGO ®",bricks,bricks,bricks
1,"What is a good tag for purchasing/acquiring/procuring pieces? I have thrown out procurement since it is not likely to be the most intuitive, but none of the other two above seem to be as accurate or intuitive. What should we use, as least to begin with?",3dprinting,beer,beer
2,"I've asked one, so let's find out! I've got another one coming up too. (I think yes, any brick-building toys should be allowed, regardless of compatibility with a LEGO product line.)",beer,bricks,bricks
3,Lego Mindstorms allows one to write embedded-programing to design robots using Legos. How much of this technology is on-topic?,bricks,arabic,bricks
4,"I suspect that Mindstorms by itself is not large enough a community, and Lego itself might not be large enough. I would vote for allowing it.",avp,3dprinting,3dprinting
5,How should I represent: Using markdown?,bricks,agur,bricks
6,"I'm already seeing a flood of low-quality and outright wrong answers to my questions get posted within seconds, and worse they are getting voted up. It's worse than the rep rush I'm used to from StackOverflow! At this point, we should be focused on good questions and the best answers. These are the answers that are going to serve as the standard for the public beta questions. Don't just throw out one line and a Google link or ""well, I think X""! You're LEGO experts; give expert-quality answers. Please do not be afraid to downvote; wrong answers and bad policies now will plague the site forever.",bricks,bricks,bricks
7,"We already have one of the what-brick-is-it kind of question and I suspect, from other LEGO communities, that we are going to get many, many more. The problem I see is that the title is useless. What do you think if we establish that the brick should be described in the question? Would that help? would that be useless?",beer,arabic.meta,3dprinting
8,"On this site, which term do we use (or prefer to use) in questions and in tags? I'm inclined to the former, but then I'm British so that's the only way it could possibly be said.",bricks,bricks,bricks
9,"There's a handful of questions about LEGO video games on Gaming SE right now. If I have a question about a video game, do I continue asking there since video games are quite different from the physical building sets themselves, or will they be on topic here as well?",bricks,bricks,bricks
10,"I would say:  It would be ridiculous if there existed another se site for brick building toys other than Lego, so welcome one and all. In related news, we should change the title of the site to Brick Overflow, instead of LEGO®. This would match our domain better too.",beer,3dprinting,3dprinting
11,"Yes, I think they should be asked on the Gamming SE as this one is about building stuff, not playing a video game. I enjoy the LEGO video-games but I think they are totally different things.",arabic,bricks,3dprinting
12,"I'm trying to use ""LEGO"" but as an American English speaker who spent ages 3-20ish calling them ""legos"", I'm sure I will slip up. I don't think it's a big problem. I think the only place it really matters is in tags, where the exact name is critical to the usefulness. Otherwise, a search for ""lego"" will match ""legos"" just as well.",agur,avp,arabic
13,I think LEGO is the brand and LEGO bricks are the bricks? Although many people call the bricks legos; I don't think that's a force that can be stopped.,arabic,bricks,arabic
14,"My 2¢: Take a step back and ask yourself, ""What is this question actually about?"" Once you eliminate these, what kind of questions are left? That should help you figure out what tag (if any) would be useful.",beer,beer,beer
15,"This was seen on creating a new brick.se account, although this may be present in other areas of the site. FF7, Windows 7, 32-Bit. ~21:00GMT. ",3dprinting,agur.meta,arabic
16,"If/when this site goes into public beta, the Mindstorms proposal will be closed. Everyone who followed/committed to it will then get an email inviting them to join this site and the existing Area 51 robotics proposals.",beer,ai,ai
17,"I submitted an edit for that question but it's not available yet - I think identification via the set and approximate function (e.g. ""ARC-170 Starfighter cockpit"") is going to be the way to go. Another alternative would be to make one very good ""Here is how you search LEGO's documentation/site for the piece you want"" and close all such questions as duplicates of that.  I am not sure this is a good plan because it can be hard to find some sets on their site; you may be looking at a fan creation with no instructions; I suspect there are even a few pieces that are not officially numbered.",beer,beer,beer
18,"I think if the question is primarily about the LEGO nature of the game, then it should be here. For example ""What set contains the Joker figure #3 seen in LEGO Batman?"" But if it's primarily about the game nature of the game, it should stay on Gaming. I proposed a similar distinction for the LEGO boardgames on Area 51 - a question like ""How can I build a Heroica-scale lava pit?"" belongs here, but ""How do I rebalance Heroica to make the barbarian's ability less useless?"" goes to Board & Card Game SE. My rationale is what the communities are interested in and know about - questions about LEGO come here, questions about gaming go there.",3dprinting,3dprinting,arabic.meta
19,A third option would be to include only lego-compatible brick systems. (I'm not sure how useful this would be.),3dprinting,3dprinting,avp
20,Thanks for letting us know.  Taken care of!,arabic,agur,agur
21,"I see lego is no longer allowed. Since this site seems to be not exclusively about Lego, is this a good idea?",arabic.meta,arabic.meta,avp
22,"I think we should keep the LEGO tag - if we rename the site to make it obvious that we welcome k-nex, etc. then it makes sense to be able to say ""I'm interested/not interested in lego"" Otherwise there's no way to filter them out later. Edit to add - mostly responding to Dori's comments to her answer: I've got no experience with knex, which (I feel) we should welcome on this site, but I'm not going to be able to answer any of the questions about that, so would like to be able to filter them out using the ""Ignored Tags"" feature. The opposite is probably equally likely: There may well be people who are experts in knex, but with limited interest in LEGO - shouldn't they also be allowed to ""Ignore"" LEGO specific questions? Finally, thinking far into a possible future - look at Facebook.stackoverflow.com if this site gets big enough that we become an ""official"" support channel for one of these toys, then providing this sort of separation is much harder if a specific toy isn't tagged correctly (we should aim high after all ;))",agur.meta,beer,beer
23,"This was discussed to some extent during the definition phase of the site: It's going to come up eventually, so can we all agree…Lego bricks not Legos? The general feeling seemed to be: Where possible (tags, FAQ, etc.) we should use the approved form, but elsewhere, not sweat it too much. Edit to add: I believe the relevant section of the guidelines is: The LEGO Trademarks may be used under certain Limited Circumstances on an Unofficial Web Site
  The LEGO trademarks (but not the logo) may be used in a non-commercial manner to refer to LEGO products or elements which are shown or discussed on a web site, as long as the trademark is not unduly emphasized or used in a way that can lead an observer to mistakenly believe that the site is sponsored or authorized by the LEGO Group. Proper Use of the LEGO Trademark on a Web Site
  If the LEGO trademark is used at all, it should always be used as an adjective, not as a noun. For example, say ""MODELS BUILT OF LEGO BRICKS"". Never say ""MODELS BUILT OF LEGOs"".Also, the trademark should appear in the same typeface as the surrounding text and should not be isolated or set apart from the surrounding text. In other words, the trademarks should not be emphasized or highlighted. Finally, the LEGO trademark should always appear with a ® symbol each time it is used. I'm not a lawyer, so can't really summarise it, however in the previous discussion, it was pointed out that we can't really police the community in terms of ""using the LEGO trademark as an adjective rather than a noun"", however where it is used on core parts of the site (FAQ, tags, etc.) then it should be as an adjective, and include the ® symbol.",agur,arabic,arabic.meta
24,Should trivia be made a tag synonym of fun?,arabic,arabic.meta,avp
25,"While minifigures may be the 'correct' term, I've never come across anyone who uses that term, instead, everyone uses minifigs, and as such the tag should be renamed. Thoughts? ",beer,agur,arabic
26,"The official product line is LEGO Minifigures and it's not an obtrusively long tag or question title, so I have to disagree - minifigures rather than minifigs. It also works better for search. A search for minifig will match minifigure but not the other way around.",agur.meta,arabic.meta,arabic.meta
27,"Are we talking about the collectables product line Minifigures, or the more general ""Mini Figures"" that are found in the Pick-a-brick selector?  Do we care about that distinction?",agur,3dprinting,3dprinting
28,"Where the submitter does not know what set it is from, perhaps we should encourage something along the lines of: what brick is this - summary description (eg 4x2x8 with holes and a window) That would at least help us get an overview from the title. We'd need to have a standard nomenclature described in the FAQ though (question on this here). ",beer,beer,beer
29,"In order to help with descriptions of pieces especially, should we define a standard for descriptive nomenclature? eg Length x Width x Height of the basic shape followed by additional identifiers this could give us examples such as a block 8 x 2 x 1, a 16 x 1 x 1 with 15 holes (technics), or a plate 8 x 2 x 1/3",agur,agur,3dprinting
30,"Generally, elements are described by the number of studs, and then height is defined by them being a plate or brick. It's then mostly the ""specials"" or over/under sized bricks that are given a height:  ",agur,agur,agur
31,"I guess we need to bottom this out once and for all - during the commitment phase a discussion was started, but didn't really resolve: Is this site only about LEGO products and other brick based toys, or is it open to all construction toys including K-Nex and Meccano (for example)?",arabic,ai,beer
32,"Users of a Stack Exchange Q&A site generally do not need or even want a 'fun' tag.  On a technical level, tags are supposed to indicate what the question is about. A question tagged 'fun' isn't likely to be about ""fun"", so that type of meta-tagging (indicating why the question was asked rather than what the question is about) is widely discouraged. The Death of Meta Tagging Stack Exchange sites are set up to solve specific problems in a field of expertise. While there's nothing inherently wrong with entertaining and social discussions, those types of conversation starters are not really what we are looking for here. It's even debatable whether we even need a 'trivia' tag, but it seems well suited to questions about the product, and the culture/language surrounding it.",agur.meta,arabic.meta,arabic.meta
33,"I think we should aim to cover three basic things: LEGO Bricks. Fundamentally, this toy dominates the building space. If we don't have this, we don't really have a site. LEGO Not-Bricks. Mindstorms, DUPLO, games, LEGOLand, Bionicle, Modulex, tables, carrying cases, alarm clocks, minifigure collections, company history, BrickMaster and MBA, Znap. The overlap is enormous between people interested in these and the bricks themselves and it's hard to separate them - is a question about a model at LEGOLand a question about bricks, or a question about LEGOLand? It's also important to cover this so the site can serve as a resource for parents (and whether we want it to or not, it probably will this Christmas). Other Bricks. Diablock, Mega Blok, Nanoblock, and undoubtedly a new system every few years. Compatible or not, all brick toys share similar building techniques. In some cases, like Diablock, they are ""not compatible"" as stock pieces but people have built adapters. That means we don't cover K'nex (perhaps shared interest but no shared building techniques), Meccano (in my experience, very little shared interest), and other progressively more marginal building systems. Otherwise I fear we'll see a gradual descent until we cover things that are barely even building toys like Domino Rally, and eventually just be a generic toy site. You might say ""I'm as uninterested in alarm clocks and Znap as I am in K'nex!"" The good news is, the rest of the world agrees with you - the potential number of questions about these things is very small and can never come to dominate the site. That is not true of K'nex. Why is it bad to offer more? Focus. If the site is 90% Lego, we're not going to attract K'nex or Meccano experts. If the site is 30% Lego, we're not going to attract Lego experts. We need experts to survive. Otherwise people will just go back to the existing Lego forums and wikis, because their questions can be answered just as poorly there.",agur,arabic.meta,3dprinting
34,"I feel like that its best that this remain only LEGO considering the size of the LEGO community and the diversity of their products. There are also no ""modern"" LEGO community websites, that I have found, and I can see this SE becoming a canoical LEGO site.",agur,3dprinting,arabic
35,"If you actually know the part, the best strategy is to use the exact same name as another site, possibly linking to it or even inserting a picture when practical. No need to reinvent our own naming conventions when there are already so many in use. I prefer to align on LDraw names which can be found via Peeron.",beer,arabic,beer
36,"What web sites, resources, and tools do enthusiasts use?  It would be helpful to have a list of these available to reference in the future.",arabic,agur,agur
37,"in my oppinion, this site should cover model construction toys in general, wich means:",beer,beer,avp
38,"Peeron/PICSL is one of the oldest and most comprehensive databases of parts and sets. Bricklink is an online marketplace that also maintains a massive parts database. Brickipedia is less comprehensive than Peeron but has details on more non-toy aspects of Lego, and after years of dealing with MediaWiki and knockoffs, I find it easier to use than Peeron.",agur,bioinformatics,bioinformatics
39,http://bricks.stackexchange.com,avp,agur,avp
40,"Eurobricks news and forums Lugnet if only for the archive  Classic Castle news and forums History Bricks my favorite blog, all the mocs I need! Brickshelf everybody's mocs MOCpages nicer moc posting environment",arabic,beer,beer
41,"Brickset: LEGO set guide LEGO: the homepage of a company started by a Danish carpenter, has some interesting info rec.toys.lego roll call: some rec.toys.lego archives LDraw: one of the most comprehensive parts database and foundation fo numerous CAO tools. Peeron uses it too.",arabic.meta,arabic.meta,arabic.meta
42,"The current ""Close as off-topic"" description reads: Questions on LEGO® - Stack Exchange are expected to generally relate to LEGOs, within the scope defined in the faq. As per the official LEGO Group fair play guidelines: Proper Use of the LEGO Trademark on a Web Site
  If the LEGO trademark is used at all, it should always be used as an adjective, not as a noun. For example, say ""MODELS BUILT OF LEGO BRICKS"". Never say ""MODELS BUILT OF LEGOs"". Can we change the Close as Off topic statement to: Questions on LEGO® - Stack Exchange are expected to generally relate to LEGO Bricks, within the scope defined in the faq. Alternatively, we could make it more general: Questions on LEGO® - Stack Exchange are expected to generally relate to brick building toys, within the scope defined in the faq. Note also that the guidelines state: [I]mproper use of the LEGO trademark cannot be made proper by including a disclaimer. Regardless of whether it reads better or not, LEGO group want it written as an adjective rather than a noun, so on core site furniture we should respect that. I'm not calling for editors to go around changing everyone's questions and answers to the correct form, although someone else might.",agur,arabic.meta,arabic.meta
43,"This has been changed to read ""LEGO Bricks"", thanks! ",arabic,arabic,arabic
44,"I work with bricks daily and I wouldn't mind of future bricks visitors associated my, presumably, totally awesome questions and answers with my company.  Since SE doesn't have such a thing as a signature block, I think it might be worth while to establish, early in our coming-out process, our community's relevant tolerance for people pushing either their commercial or non-commercial sites. It feels to me like this has probably been hashed out somewhere else, but what counts is what we want in our community.  I know, for example, Joel S. recently talked about this on a recent SE podcast. I personally feel that ""casual links are ok, but don't be annoying about it"" is a good-enough guideline. There is a tension, in that we obviously don't want the site to be spammy, but also, we don't want to exclude the people that are literally professionals, either.  The people that are expert enough to have their own site will always have a need or desire to associate their awesome answer back to their site.  If they can't link back, then they are driving traffic away from their own site towards bricks.stackexchange.com.  We don't people to have make that choice. Here is a concrete example: I recently asked this: LEGO Safety: Known risks and how to avoid them? I had already started writing a blog post on my website (Ascendly.com) on this topic and wanted to take advantage of bricks.se.com to make my post even better.  It is my intention to link to the SE question in my post, and add link in my question back to my post.  How would you react to such a link? How did you feel that I inserted that link to my site in the above paragraph? How would you react if somebody specifically mentions the they work with company X, or if they are a builder-for-hire?",arabic.meta,3dprinting,bioinformatics
45,"If you you have some relationship to a product, website, or company that you mention in your post, that relationship must be fully disclosed in your post.  But be careful. If a substantial proportion of your posts seem to exist only to promote your product or website, that will not be tolerated. The community frowns on overt self-promotion and tends to vote it down and flag it as spam. Post good, relevant answers, and if some small portion of them happen to be about your product or website, so be it. However, you must disclose your affiliation in your answers.  If a large percentage of your posts include a mention of your product or website, you're probably here for the wrong reasons.  If you can stay within the above guidelines, and offer questions and answers of genuine benefit to the community which happen to mention your affiliation or product in context — and with full disclosure — then your contributions are welcome.",arabic,arabic,arabic
46,"There are a number of elements to this: Signature Blocks: Nope, these are quite clearly frowned upon, but you can add links to your profile - in fact, if you do, they get picked up in the ""Expanding user cards"", which act as a signature:
 You can see more details here: Links from Bricks.SE: In general, it's frowned upon to answer with just ""read my blog post on this here"" - ideally, you would also summarise the post in the answer so that if the blog were to disappear, the bulk of the information would still exist here. Content from Bricks.SE: All content on the StackExchange network is released under the Creative Commons Attribution-ShareAlike License, meaning you are free to reuse the content provided that: Links to Bricks.SE: As stated above, if you use content from here, you should link back to it, so links in are fine - indeed, once we're out of private beta, the Share links will be enabled and actively encouraged:
 These were disabled while we were in private beta because unless you're in the beta you couldn't get in - see the comments to this question about Private Beta accounts not appearing on the account tab for more thoughts on linking to ""brick walls"". There's even a couple of badges for high referrers:",ai,agur,ai
47,Here are some notable BIONICLE and Hero Factory resources:,avp,agur,avp
48,"I recently posted this question about how to build a good bridge out basic bricks ( Bridge from just basic bricks? ), which got closed as being too open-ended, apparently.  I found this to be, of course, extremely discouraging.  I would suggest How to Build X type of questions are acceptable.  They are fun, engaging, and don't hurt anybody.   Our community is young and traffic is still light, but I'm confident that there will be more questions like this.  The issue is whether we turn users with these question away, or welcome them. As a practical example, if my bridge question is unacceptable, then I would suggest that following must also be unacceptable: Personally, I think all of the above questions positively contribute to the community - I would hate to see them go away.",bioinformatics,beer,arabic.meta
49,"First, I don't think it's a good idea to compare your question to ""How does one get a job as a LEGO designer?"" or ""What is a good ratio to buy bricks in?"" These questions cover a totally different topic, and so demand different standards (or different applications of the same standards). The problem I see is one of scope. A Mindstorms charging station and the pivot-arm suspension (given the wheel sizes as specified in the question) are concrete goals with specific restrictions. ""A bridge with basic bricks"" is a vast universe of possible designs. How long? How much weight must it support? Beam or cantilever or arch? Even your question varies in whether you allow plates or not. Good questions about how to build bridges can be written. I just don't think yours, as written, was one of them.",bioinformatics,3dprinting,3dprinting
50,"I have spent a lot of time on StackOverflow and am pretty familiar with the types of questions that are and are not allowed on the site.  I am a little unsure as to how well the strict question rules transfer over to this site, however.  Typically, questions that do not have concrete answers or are opinion-based are discouraged, as are requests for listing of resources.  I don't think that this level of stringency is appropriate for this site.  An example: What is the best tool for computing gene-level expression? This might immediately be flagged for deletion because it is both a resource request and opinion based, but keep in mind: Thoughts?",agur,bioinformatics,bioinformatics
51,When I signed up for the site and look up in the part were the review button was suppose to be it wasn't there as indicated by this screen shot here.  This seems kind of weird considering the fact that I signed up for a few private beta site before and there is all ways a review button as soon as I sign in. (because of automatically getting the close privilege.) Please note the reviews are still accessible via the link: https://bioinformatics.stackexchange.com/review  If this is just a status by design feature and not a bug sorry for the misunderstanding.,agur,3dprinting,agur
52,Such open-ended question should be closed in my opinion. A better question for the site would be  What is better tool for computing gene-level expression A or B? This question is still open to opinionated personal experience using the tools but can be answered with articles comparing both tools.  This way we can have a tag for gene-level-expression and group there questions comparing tool. The reader after reading the questions and articles might end up with a good knowledge of the tools available and used by the community.  As suggested in the comments: What are the pros/cons of computing gene level expression with A or B?  This might be a better alternative,bioinformatics,bioinformatics,bioinformatics
53,"When the proposal of Bioinformatics started there was a discussion in Biostars about the this site (and SE in general compared to Biostars). Some of the points raised are: How do we want the community to handle this issues? Additionally there are also seqanswers, Bioconductor, Galaxy community and other communities (and mailing groups) around different tools and projects.",agur,agur,bioinformatics
54,"Let’s standardise some tags. For instance, there are already two competing conventions at work: Either both should use a dash, or none should. I propose the slightly more readable variant: using dashes to separate ‹tech› from “seq”. That is:",bioinformatics,arabic,bioinformatics
55,"Several other communities (in particular Stats and Biology, which are closely related to Biofx.SE) have MathJax support. This would be highly desirable here as well, since pseudocode and equations abound in bioinformatics. Case in point, my first two answers would both benefit from it.",bioinformatics,arabic.meta,bioinformatics
56,Apparently you need 350 reputation to access the review queue.,arabic,bricks,bricks
