,body,rf_prediction,nb_prediction,lr_prediction
130,"This is not a problem. And your graph has nothing to do with snobbery.  There are indeed some excellent lager beers out there. However, it is also among the lagers that you find plenty of low-quality beers. And these beers are sold globally. Hence they are widely known and also well known to novices.  The quality IS higher among the strong beers and it is among the strong ones that you find the world's best beers. That's a fact and your graph shows exactly that. And these strong high quality beers are not necessarily known to novices. ",agur.meta,agur,bioinformatics
131,"An edit to this question suggests that we have a tag for Poland.  Is it a good idea to have location-specific tags?  I'm guessing that most of the content on here is based in the US, should we have a ""United States"" tag, which would then (potentially) run rampant?  UK is also very popular, I surmise.  Poland kind of makes sense, but only in that it's a ""destination"" for most of the user-based; would Polish users asking questions about an American beer then tag ""United States""? (I could ask about the granularity as well -- country vs. state / province, etc, but I suspect that's a good enough sub-question once this is resolved.)",ai,avp,ai
132,"I think that they should be; it's a fairly similar beverage in terms of consumption and enjoyment, and I know quite a few beer bars which also cater to the cider enthusiast.",beer,beer,beer
133,"Dealing with Wikipedia isn't what we're here for, but SE is pretty great at establishing canonical references, and has lots of google juice. There's no reason we can't house that information here. ",arabic,3dprinting,3dprinting
134,"I think they can be on topic, but the questions I've seen seem to be kind of trivial and superficial. Example question ""What goes good with British style dinners"" titled ""What's a good beer to have with steak and potatoes?"" I think for it to be a good fit on the site, it should be a little more specific with menu and goals. Take steak... Filet? Porterhouse? NY strip? Ribeye? Sirloin? Seasoning? Along with that, the ""what and the why"" of it. I found this example answer on beeradvocate: I recently paired homemade chili with Stone's Chipotle Smoked Porter. I'm sure the regular and the vanilla versions would work as well, as the mix of smoke and malt (in taste and texture) were the key components in complementing the spicy food. However, I found the chipotle added a nice roasty heat, so while it quenched your thirst after a spicy bite like a glass of milk might, it imparted just a smidge of heat in the aftertaste to segue into your next chili spoonful... I was surprised a chili and a porter could provide a real pairing experience, akin to a wine pairing. ",beer,beer,beer
135,"I think regional granularity makes sense in cases where there may be a regional beer style.  Specificity would really depend on a case-by-case basis.  Some countries may have common beer styles while other countries vary more internally and have states or subregions.  I could see asian, irish, and bavarian all making sense. With regards to united-states, that may make sense when talking about law, drinking culture, more universal preferences.  Whereas we may see boston or midwest-united-states talking about styles or preferences.",agur.meta,agur,agur
136,"Jaydles' answer provides some reasonable guidelines for most questions that would reasonably be considered ""biology"" questions. However, I recommend treating one specific subcategory a bit differently: questions seeking medical advice.  I hesitate to even bring this up because we haven't actually seen any of these yet, but if past sites on related topics are any indication, a few of them will crop up eventually... And when they do, Please resist the urge to answer them. Topics such as the treatment of chemical dependency, withdrawal, poisoning, allergies and so on have very serious potential consequences, and those dealing with them should be strongly encouraged to seek out a medical professional. Remember, answers here will be found and read by many, many people beyond just the asker - putting potentially life-threatening advice out on the 'Net is not something we should encourage. ",beer,3dprinting,3dprinting
137,"Unless the question is specifically about Poland (which doesn't seem likely), I would suggest this is not a good use for tags. If the location is relevant, that information should be include in the body of the question. But if I like to drink beer on my back porch on a hot day, I wouldn't need a tag for [summer] and [outdoors]. A bit of an exaggeration, but you don't really need a tag every keyword you just happened to mention in your post. That doesn't make tags more useful. Location-based tags are typically just a crutch for asking a complete and well-qualified question.",beer,avp,beer
138,"I suspect there is going to be a set of questions that would be suitable for either site. For example, asking how best to poor a bottle of beer without disturbing the sediment: a question that is relevant to many homebrewed beers, but would also be of interest to general beer drinkers if they encountered such a beer. I think the site will be stronger if we keep such shared scope questions.",arabic.meta,arabic,beer
139,How to evaluate Beer.stackexchange: These are what I thought about the closed beta proccess.,arabic,bioinformatics,avp
140,"We've had a half dozen questions that really clearly belong on Homebrew.se already. It's in our best interest to nip these in the bud sooner than later, so can we set up the migration path a bit more quickly than might be normal for a beta? Or at least a custom close reason that mentions Homebrew.SE?",bricks,agur,beer
141,"Custom close reason should come soon, though maybe not until after we get our pro-tem mods (about 2 weeks into public beta), though we may be able to campaign to get the community team to add one about homebrew. However, migration paths will not come until we have graduated which is too far in the future for us to be thinking about right now.",avp,agur,arabic
142,"Tags are used for categorization, but more important are their filter capabilities. You can filter by tag or filter out tag. Would someone like to observe poland tag? For sure! If someone is living there, he/she will be interested in answering questions about Polish beers and the specific of beer consumption there. So yes, we need such tags!",beer,beer,3dprinting
143,"If hard cider were sold alongside the wines in the store, rather than in the beer section, would that change anyone's answer? Cider is the result of fermenting the pressed juice of a fruit. Wine is the result of fermenting the pressed juice of a fruit. The Charmat process that produces sparkling wines in France is also used to produce cider.  They are two different types of drinks, produced in dissimilar ways. That being said, as wax says, they are marketed to the same audience, kept in the same areas of the store, and are regarded as being of a beer family. I think they could be on topic, we would just have to take care as a group to make sure the answers reflect the spirit (hah! See what I did there?) of the site.",bioinformatics,bioinformatics,beer
144,It really seems like homebrewing is a subset of beer.  It seems like the two should be contained in the same q&a site.  What is the rational for creating two separate sites? EDIT: This may be relevant to the discussion: the impetus for asking this question was posting this question on beer.se: https://alcohol.stackexchange.com/questions/358/what-ingredients-would-be-most-appropriate-to-prototype-new-flavors-in-a-randall?noredirect=1#comment371_358  The overlap between beer and homebrewing looks significant to me..,beer,bioinformatics,beer
145,"This has been answered in a couple of places, namely in a comment, but I'll go ahead and give it a go. Mission  Homebrew has a pretty specific mission and vision. To support home brewers in the brewing of their own beer. To do that they do take on a variety of topics around the beer industry, tasting, ingredients etc. However, the scope of this site is broader and more expansive. It includes large scale production, excludes super small scale production and generally is more focused on the consumption of beer rather than production. Audience This is where the real differences lie. While there is likely a good bit of audience overlap (probably all homebrewers are beer drinkers), Home brewers are a subset of all beer drinkers. This site is intended to appeal to the superset of beer drinkers. Conclusion The only real issue here is the ordering of the site's beginnings. Typically how site parentage would work would be that the larger audience site would be the first, and then the separate interest group would splinter. In this case the separate interest group already has their own site with their own question set. There are a couple of interesting questions here on meta that address this further:  Is Homebrewing on topic? What should we do when a question already has an answer on the Homebrewing site? And lastly, I'd like to point back to an instance where I had many of the same thoughts I've seen re: homebrewing with another set of sites that I was involved in. The Sport.SE/Fitness.se meta crisis. Shog set me straight here, and I've come to see his way of thinking about these things. It's worth a look back at what was said there to inform any future discussions here.",agur,3dprinting,beer
146,"I tend to agree with you. I will be evaluating the private beta of ""Beer SE"" soon, and this is what has become evident to me as I watch this site develop: My Beer SE Evaluation The cross-cultural interests between ""Homebrew SE"" and ""Beer SE"" have way more overlap than I would have anticipated. I am not typically an advocate for combining producers and end users, but in this case, there is simply too much overlap of interests — not necessarily physical audiences, but interests — to ignore. Hypothetically, if we were to remove the ""brewing-related questions"" from Beer SE (I'm not suggesting that), this site would become one big snooze fest fast. After I figure out what temperature to keep my beer… and how to keep it going skunky, just about the only interesting questions left are those that DO veer into what goes behind the brewing process. The deeper ""consumers"" here are asking about the ""artisanship""… and that's the best part of this site. It makes sense, really. When there's a fervent appreciation for a subject (at least food/drink space), the more-engaged experts almost have to delve behind the scenes to study what separates good brews from bad; to understand the parameters that go into what they're ""appreciating.""  You don't have to be a literal ""brewer/craftsman"" to have an implicit interest in the subject. Many of the beer enthusiasts here are curious about the craft — you almost have to, to appreciate the subject — and that's why they are asking about it here. And of course the craftsmen need to know what makes a good beer … so there's a lot of cross-cultural interests here, whether you an actual, literal ""home brewer"" not.  It simply makes sense to combine these subjects. While the brewers and consumers are not physically the same exact audience, they do largely seem to have the same range of interests… and questions. Essentially, the scope of these two sites overlap considerably; much more than I would have anticipated.  Put them back together. They will be stronger in combining their expertise; stronger for sharing their mutual interests and appreciation for the subject.",agur.meta,bioinformatics,bioinformatics
147,"I'm in the ""No"" camp, and I think Wax Eagle answered pretty well.  I'd just like to expand on the audience point a bit, though: Although H.SE and B.SE have very similar audiences right now, they'll probably diverge later. To put it another way, the people likely to commit to both sites are pretty similar, but the people likely to visit each site is significantly different.  The people who are interested in beer enough to go out and help found a community like B.SE are far more likely to brew than the average mild beer enthusiast. As such, I predict that we'll get more and more non-brewers as we exist public beta.  Keeping the sites separate will serve those people better than a combined one.",bioinformatics,3dprinting,3dprinting
148,"What should we do about questions like this? United States Beer Shipping Laws It's clearly something people want to know about: Can I ship my homebrew to my brother on the east coast?  Is beer trading legal?  Can I join a ""Beer of the Month"" club?  It seems like that's the sort of question one would go to a beer stackexchange site to answer. However, as people have pointed out in that question's comments, the answer may depend quite a bit on the state, and we don't want 50 copies of the same question: ""Can I ship beer to Idaho"", ""Can I ship beer to Washington"", etc etc. So, what should we do about questions regarding US law that may vary by state?",ai,3dprinting,3dprinting
149,"For questions to be good here, they have to be of sufficiently limited scope. We should not expect people to provide as single answer for all 50 states, or even for the dozens of counties in each state that might have a different set of laws. More importantly, we're here to help people solve their problems. A general answer for all of the US, or even their state, might not solve their problem. We can, and really, must, deal in specific questions with specific answers. So if I want to ship some beer to a friend, I should ask about the laws that are relevant to my case, and no more",agur.meta,3dprinting,agur
150,I've been waiting for this forum to open for too long! Congratulations!,avp,agur,avp
151,"I was about to ask a beginner question on getting started with home recording. Can someone suggest a set of tags that may be useful to me and others? If this should have been asked on meta site, please feel free to move it over :-)",arabic,arabic,arabic
152,"According to http://audio.stackexchange.com/tags
I'd say ""home-studio"" would be enough.
The meta-tag ""beginner"" is deemed inappropriate :)",avp,3dprinting,avp
153,I'm curious what people think of having tags for every instrument vs a generic instrumental tag.  ,arabic,avp,avp
154,My advise would be that if you're in doubt  ask it anyway and add whichever tags you feel are appropriate. Other users can always retag your questions.,avp,avp,avp
155,I'd go for that. Each instrument is unique when it comes to reproducing its sound faithfully.,arabic,avp,avp
156,The more I think about it the more I like the idea of instrument-specific tags.  I can see myself searching for mic questions within a guitar tag for example.,agur,ai,avp
157,"For sure. There ought to be a ""vocals"" tag, and vocals is ""just"" another instrument after all. ;-)",arabic,3dprinting,arabic
158,I think this is a good idea. I would also extend this to include all major types of audio equipment as well.,arabic,avp,arabic
159,"+1, it's a good idea",avp,agur,avp
160,"Welcome aboard everyone! Sorantis, please note that StackExchange is more than a forum alone.   If you haven't already, check out the about page... :-) ",arabic,bioinformatics,arabic
161,"For filtering and searching purposes, I agree with this idea so it can be more specific. I would propose to only use the instrumental tag when we are talking about them in general...",arabic,arabic,avp
162,"One of The 7 Essential Meta Questions of Every Beta. Much of the FAQ will be somewhat boilerplate: “be nice,” “how to create an account,” “how to ask questions” — it’s all pretty static. Even the sections about “what kind of questions should I (not) ask here?” comes primarily from the Definition phase of Area 51. But the questions you want to discuss in meta are those issues specific to your site that need to be mentioned in the FAQ. It took almost a year to figure out the list of “we want these sort of questions” and “we don’t want these sort of questions” on earlier sites. Area 51 gave you a head start but we should also be working out other FAQ-related issues specific to our topic and our community. See the FAQs of established StackExchange 2.0 sites to see what the FAQ needs to contain and look how they are forming the FAQ on other StackExchange 2.0 beta sites to get some inspiration through examples.",agur.meta,3dprinting,ai
163,"One of The 7 Essential Meta Questions of Every Beta. Robert Cartaino has made an article, here is a small slice of it: Instead of stressing out over the vagaries of the brutal, cut-throat .com domain market and debating the “least worst” domain name options ad nauseam, simply focus on telling the world what your community is about. Don’t even think about the domain name! Give us the one sentence “elevator pitch” for your community. How would you explain your site to a stranger you met on an elevator? It’s about … what, exactly? — Stack Overflow Blog - Domain Names: The Wrong Question For more insight I've wrote a detailed post about Elevator Pitches in the past. As it helps to define the site we should be starting this early, here is the post he made on other sites: Let's start with a killer ""elevator pitch!"" This isn't as easy as it sounds. Imagine the user who will never read your FAQ and you have two seconds to grab their attention. It should be catchy but descriptive. It should be thoroughly clear but painfully concise. Make every... word... count.  Here are some creative examples:  A shorter elevator pitch can be used as a tagline — something you can display in the header at the top of the page. If it doesn't fit, consider shortening it or creating a separate tagline. Here are some great examples:  A logo begs for it own little, short tagline — like a motto. Maybe the tagline inspires the logo; Maybe it's the other way around. Mottos make good t-shirt, bumper stickers, and other marketing material. Either way, you'll recognize a good motto when you see it:  …and perhaps all this leads to a proper name and domain for your site… eventually. So let's start from the basics. Come up with a killer elevator pitch, tagline, and/or motto! ",agur,avp,bioinformatics
164,"Would it be appropriate to create tags for (broad) genres? For example, mixing heavy metal is much different than mixing folk music... instances like that. I think it'd be useful.",agur,arabic,arabic
165,"One of The 7 Essential Questions of Every Beta. This one is pretty straightforward. Solicit contributions, throw out ideas, post preliminary (or finished) designs, and be supportive and respectful of other people’s ideas and creativity. We have designers on staff to come up with site designs but, if an idea stemming from the community stands out as exceptional, we are happy to use it. Logo guidance, from Jin (resident UI designer for at least some of the Stack Exchange sites): Please note: I prefer gray-scaled logo submissions, that way we can judge the IDEA of the logo more objectively. We can always add colors to the logo later. Also, the logo itself(sans the site title text) should be able to fit in a square dimension nicely. This way we can use it for favicons, mobile touch icons etc.",agur,3dprinting,3dprinting
166,"Fine for me. If the question is about heavy metal, having a tag that denotes this is very useful...",arabic,agur.meta,arabic
167,"One of The 7 Essential Meta Questions of Every Beta. This is rapidly becoming a hot issue across the entire network: how to promote your site and how to reach out to the experts and pundits in your industry. We can come up with budgets and promotions but — more than any other issue raised here — the means and ideas about how to reach your target audience HAS TO come from you and your community. Has to. Has to, has to, has to! We simply are not experts in your field. We don’t have the the connections nor the experience you bring to the table. You are both our evangelist and our ambassador.",beer,beer,beer
168,"Example Question: Digital Effects Unit Other sites tend to disallow too localized questions as in the long end they could result in outdated information and they would thus clutter the site, the details that are important to that question just change over time which makes it unfeasible to keep it open as it would result in a bloat question once it is outdated. So, do you agree that we should disallow this and inform the user? Or do you see a reason to allow this?",agur,avp,beer
169,"Example questions: All Around Workhorse Studio Microphones Digital Effects Unit Technology moves so rapidly that the best shopping recommendations will be utterly obsolete within a year! What’s the point of a bunch of labor intensive questions that provide only temporary benefit to a limited (some might say Too Localized) audience? There isn’t any — Stack Overflow Blog - Q&A is Hard, Let's Go Shopping! What do you think about it... Should we disallow them? Are there reasons to allow them?",arabic.meta,3dprinting,arabic
170,"I agree these add useful information, but I'd add that genre tags should only be added if it is relevant to the question.  For example, if I'm asking about how to copy tracks in my DAW it probably doesn't matter whether I'm working with hip-hop or classical music.",agur,avp,ai
171,"I think the obsolescence cycle of audio recording hardware is a lot different than that of computers and electronics.  There are many microphones, mixers, effects boxes, etc that have been around for many years and are still widely used today.  I think these questions are much more useful in the audio production arena than in many of the other StackExchange sites. ",agur,3dprinting,agur
172,"The low-hanging fruit of ""get in my head and do my research for me"" will make this site a whole bunch of no-fun really fast. That's not a site built by experts, for experts. Consider instead asking about about what issues to consider to solve a specific problem when making equipment buying decisions. At least the answers will be a product of expertise and not random opinion. The problem with product recommendation is that they are typically asked somewhat indiscriminately. When someone asks  ""What do you think of Shure microphones?"" or ""What are the best studio headphones?"", how can you possibly answer that objectively in a way that will help those who come after? An ""expert answer"" would be highly localized to a specific person and their specific situation. But if you must: The question should be very specific, asking about a particular product… or at least be very, very detailed about the situation you are trying to solve. That way the question can be answered at least somewhat objectively… consistent with what you would expect from Stack Exchange sites.",bioinformatics,arabic.meta,ai
173,"I have no problem with that question. We're here to answer people's questions, now. If they're going to be usedful for the next ten years that's a nice plus. I don't see that question as ""localised"" - in fact it's easier to help people if you have more specifics about the situation.",bricks,ai,ai
174,"I was actually thinking about this the other day, when mixing something like metal guitars (which I do often) or mixing DnB drums, I would like to be able to tag it metal or dnb or something.",beer,3dprinting,arabic
175,"How about instrument families instead? In a recording context there tend to be parallels between different forms of the same instrument. In the more mainstream stuff (Bass, Guuitar etc.) each instrument has a very specific set of rules/guidelines for how to record it (DI the bass, mic the guitar, etc.), and the same for the more esoteric instruments that don't really have parallels. But Alto Saxophone vs Tenor Saxophone? Cello vs. Double Bass (bowed, not jazz-style)? Perhaps we would be best with some specific tags, but mostly just tags like ""bowed-strings"", ""horns"", ""brass""?",bioinformatics,beer,beer
176,"Agree, This would be a good idea. I'm a member over at MPC-Forums.com where the members who go there only care about AKAI MPC products. Its a very very active community and being able to filter searches or results on Brand and product through tags/etc would be a great value add. ",agur,agur,avp
177,That's what we have Bing and Google for :-),arabic,agur,avp
178,Why change it? I love it exactly as it is :-),arabic,arabic,arabic
179,"So, this question: http://audio.stackexchange.com/questions/105/what-is-the-best-setup-under-10k-closed Was closed as argumentative/subjective. Isn't this the exact type of question we want here?  Isn't it useful to see a list of under 10K systems on could put together?  Granted, it's somewhat subjective, but it can't be any more subjective than ""how do I mic drums?"", and it's certainly less objective than ""What type of artists are likely to pay their bills?"" (e.g.)",bioinformatics,ai,ai
180,"First off, I agree, I think this could be a useful discussion.  However, when I read Robert's reason for closing, I can see his position that we might want to discourage these types of questions until the site and community are well-established.  We want to attract experts, and this will be done will specific, technical questions, not general abstract questions.",agur,arabic.meta,agur.meta
